{
  "agent_did": "did:web:agent.buyer-example.com",
  "pubkeys": [
    {
      "public_key": "0x11111111111111111111111111111111111111111111111111111111111111111111111111111111111111111111111111111111111111111111111111111111",
      "added_at": "2026-06-01T00:00:00Z",
      "status": "active"
    }
  ],
  "principal_id": "11111111-1111-4111-8111-111111111111",
  "delegation_sig": {
    "signature": "0x2222222222222222222222222222222222222222222222222222222222222222222222222222222222222222222222222222222222222222222222222222222222",
    "signer_address": "0x2468135790246813579024681357902468135790"
  },
  "a2a_card_url": "https://agent.buyer-example.com/.well-known/agent-card.json",
  "erc8004_ref": "eip155:8453:0x0000000000000000000000000000000000dEaD/1234",
  "ai_disclosure": true
}
